{
  "$schema": "./schema/minsky-shortcut.schema.json",
  "name": "Minsky · constraint of the week",
  "description": "MAPE-K's current bottleneck under TOC, surfaced from the local Tailscale-reachable dashboard. Polls /watch.json and shows the constraint-of-the-week field.",
  "shortcut_kind": "fetch-and-show",
  "endpoint": {
    "method": "GET",
    "url": "http://minsky.tail-scale.ts.net:8080/watch.json",
    "tailscale_host_var": "MINSKY_TAILSCALE_HOST",
    "port": 8080,
    "path": "/watch.json"
  },
  "extract": {
    "action": "Get Dictionary Value",
    "key": "constraint-of-the-week",
    "metric_id": "self-improvement-velocity",
    "vision_md_success_row": 4
  },
  "display": {
    "action": "Show Result",
    "format": "{value}"
  },
  "watch_surface": true,
  "anchor": "Card & Mackinlay 1999 (glanceable display); Weiser & Brown 1995 (calm tech); user-story 005 (three-numbers Watch); Goldratt TOC (constraint focus).",
  "build_runbook": "../README.md"
}
